{
  "id": "unicamp-2024-ad-p2",
  "instituicao": "UNICAMP",
  "processo_seletivo": 2024,
  "modalidade": "acesso_direto",
  "tipo": "regular",
  "turno": "Prova 2 (tarde)",
  "formato": "resposta_curta",
  "data_aplicacao": "2023-11-20",
  "fontes": {
    "prova_pdf": "https://www.comvest.unicamp.br/residenciamedica2024/provas/dAD2.pdf",
    "gabarito_pdf": "https://www.comvest.unicamp.br/residenciamedica2024/resp_esperadas/resp_ad2.pdf",
    "gabarito_retificado_em": null
  },
  "valores_referencia": "VALORES DE REFERÊNCIA DOS EXAMES LABORATORIAIS, UTILIZADOS NESTA AVALIAÇÃO:\n\n| EXAME VALOR | REFERÊNCIA |\n|---|---|\n| Ácido úrico | Homem: 3,5 a 7,2 mg/dL; mulher: 2,6 a 6,0 mg/dL |\n| Albumina plasmática | 3,5 a 5,2 g/dL |\n| Bilirrubina total | 0,3 a 1,2 mg/dL |\n| Cálcio sérico | 8,8 a 10,2 mg/dL |\n| Creatinina | Homem: < 1,2 mg/dL, mulher: < 0,9 mg/dL |\n| CPK (creatina fosfoquinase) | Homem: < 190 UI/L, mulher: < 170 UI/L |\n| Colesterol total | < 200 UI/L |\n| LDH (ou DHL) | Homem: < 680 UI/L, mulher: <450 UI/L |\n| HDL-colesterol | Homem: ≥ 40 mg/dL; mulher: ≥ 50 mg/dL. |\n| LDL-colesterol | < 100 mg/dL |\n| Triglicérides | < 150 mg/dL |\n| Ferro sérico | 60 a 180 ug/dL |\n| Fosfatase alcalina | Homem: 40 a 129 UI/L, mulher 35 a 103 UI/L |\n| Fósforo sérico | 2,5 a 4,5 mg/dL |\n| Lactato | 0,5 a 1,6 mmol/L |\n| Saturação transferrina | 20 a 45% |\n| TSH | 0,3 a 4,2 uUI/mL |\n| T3L | 0,20 a 0,44 ng/dL |\n| T4L | 0,9 a 1,7 ng/dL |\n| Glicemia | 60 a 99 mg/dL |\n| Ureia | < 65 anos: 17-48 mg/dL. ≥ 65 anos: < 71 mg/dL. |\n| Sódio (Na+) | 132 a 146 mEq/L |\n| Potássio (K+) | 3,7 a 5,4 mEq/L |\n| TGO | Homem: <40 UI/L, mulher: < 32 UI/L |\n| TGP | Homem: < 41 UI/L, mulher: < 33 UI/L |\n| TIBC | 225 a 450 ug/dL |\n| Magnésio | 1,31 a 1,91 mEq/L |\n| Fósforo | 3,0 a 4,5 mg/dL |\n\n| Hemoglobina Hematócrito Leucócitos Plaquetas VCM CHCM | Homem: 14 a 18 g/dL, mulher: 12-16 g/dL Homem: 41-52%, mulher: 36-46% 4.000 a 10.000/mm3 150.000 a 400.000/mm3 81,7 a 96,8fL 32,0 a 36 g/dL |\n|---|---|\n| Exame de urina Densidade pH Hemácias Leucócitos Proteína | 1005 a 1035 5,0 a 8,0 Até 5/campo Até 5/campo Negativo/traços |\n| Proteinúria 24 horas | < 0,15 g/24 horas |\n| Albuminúria | < 30 mg/g |\n| Proteína/creatinina (amostra urina) | < 0,20 |\n| Gasometria venosa | pH: 7,33 a 7,43 HCO : 18 a 23 mmol/L 3 PCO : 38 a 50 mmHg 2 Cloro: 98 a 106 mmol/L |\n| Hemoglobina glicada (HbA1c) | 4,5 a 5,6% |\n| Gama GT | Homem < 85UI/L; mulher < 38UI/L |\n| PSAtotal | < 4,0ng/mL |",
  "total_questoes": 60,
  "questoes": [
    {
      "id": "unicamp-2024-ad-p2-q61",
      "numero": 61,
      "area": "Clínica Médica",
      "formato": "resposta_curta",
      "enunciado": "Homem, 62a, em acompanhamento médico regular na Unidade Básica de Saúde por hipertensão arterial e obesidade, comparece à Unidade de Emergência queixando-se de dor e edema em joelho direito há um dia. Nega episódios semelhantes ou trauma recente. Exame físico: eritema e aumento de volume do joelho direito, com dor de forte intensidade à palpação e sinal da tecla positivo. A CONDUTA INDISPENSÁVEL A SER REALIZADA NO MOMENTO É:",
      "alternativas": null,
      "imagens": [],
      "gabarito": {
        "letra": null,
        "resposta_esperada": "Punção articular ou artrocentese diagnóstica",
        "ampliado": false
      },
      "anulada": false,
      "fonte": {
        "pdf": "https://www.comvest.unicamp.br/residenciamedica2024/provas/dAD2.pdf",
        "pagina": 5
      }
    },
    {
      "id": "unicamp-2024-ad-p2-q62",
      "numero": 62,
      "area": "Clínica Médica",
      "formato": "resposta_curta",
      "enunciado": "Adolescente, 16a, é trazida ao Pronto-Socorro por falta de ar e mal-estar há dois dias. Exame físico: vígil e confusa; mucosas secas; peso=66Kg; PA=76/48mmHg; FC=124bpm; FR=28irpm; T=37,4ºC; oximetria de pulso=96% em ar ambiente. Exames laboratoriais: glicemia=560mg/dL; creatinina=0,9mg/dL; potássio=3,2mEq/L; sódio=130mEq/L. Gasometria arterial: pH=6,97; HCO3=12mEq/L; PaCO2=24mmHg; PaO2=112mmHg; cloreto=95mEq/L. ALÉM DA REPOSIÇÃO DE POTÁSSIO, A CONDUTA IMEDIATA É:",
      "alternativas": null,
      "imagens": [],
      "gabarito": {
        "letra": null,
        "resposta_esperada": "Expansão volêmica com soro fisiológico (0,9%) ou com Ringer ou com cristaloide. Insulina não será aceito.",
        "ampliado": false
      },
      "anulada": false,
      "fonte": {
        "pdf": "https://www.comvest.unicamp.br/residenciamedica2024/provas/dAD2.pdf",
        "pagina": 5
      }
    },
    {
      "id": "unicamp-2024-ad-p2-q63",
      "numero": 63,
      "area": "Clínica Médica",
      "formato": "resposta_curta",
      "enunciado": "Homem, 48a, procura o Pronto Atendimento por vômitos e fraqueza há uma semana. Perdeu sete quilos nos últimos seis meses. Antecedentes: hipertensão arterial, etilismo (1 garrafa de destilado por dia há 15 anos) e tabagismo de 20 anos-maço. Exame físico: regular estado geral; descorado (+/4); desorientado; peso=48Kg; altura=1,76m; PA=112/64mmHg; FC=114bpm; FR=14irpm; oximetria de pulso=96% em ar ambiente. ANTES DA ADMINISTRAÇÃO DE CARBOIDRATOS, DEVE SER PRESCRITO:",
      "alternativas": null,
      "imagens": [],
      "gabarito": {
        "letra": null,
        "resposta_esperada": "Tiamina ou vitamina B1. Não será aceito apenas vitamina B ou complexo B.",
        "ampliado": false
      },
      "anulada": false,
      "fonte": {
        "pdf": "https://www.comvest.unicamp.br/residenciamedica2024/provas/dAD2.pdf",
        "pagina": 5
      }
    },
    {
      "id": "unicamp-2024-ad-p2-q64",
      "numero": 64,
      "area": "Clínica Médica",
      "formato": "resposta_curta",
      "enunciado": "Mulher, 45a, é trazida por familiares ao Pronto-Socorro por sonolência iniciada há 30 minutos. Exame físico: PA=102/74mmHg; FR=5irpm; FC=66bpm; T=36,30C e oximetria de pulso=90% em ar ambiente. Exame neurológico: pupilas mióticas; isocóricas; com leve resposta à luz; sem alterações neurológicas focais. Escala de coma de Glasgow: resposta verbal=2; resposta motora=4; abertura ocular=2. Ausculta pulmonar com raros roncos difusos. Glicemia capilar=122mg/dL. Iniciada ventilação com dispositivo bolsa-valva-máscara, enquanto se pondera a necessidade de intubação orotraqueal. A MEDICAÇÃO INTRAVENOSA INDICADA PARA ADMINISTRAÇÃO IMEDIATA É:",
      "alternativas": null,
      "imagens": [],
      "gabarito": {
        "letra": null,
        "resposta_esperada": "Naloxone",
        "ampliado": false
      },
      "anulada": false,
      "fonte": {
        "pdf": "https://www.comvest.unicamp.br/residenciamedica2024/provas/dAD2.pdf",
        "pagina": 5
      }
    },
    {
      "id": "unicamp-2024-ad-p2-q65",
      "numero": 65,
      "area": "Clínica Médica",
      "formato": "resposta_curta",
      "enunciado": "Homem, 31a, procura Pronto-Socorro com quadro de tosse produtiva há dez dias e episódios de febre não aferida com queda do estado geral. Refere inapetência e emagrecimento na última semana. Antecedentes pessoais: etilista há 10 anos. Exame físico: mau estado geral; sonolento; desidratado; descorado +/4; PA=95/63mmHg; FC=113bpm; FR=22irpm; T=36,1oC; oximetria de pulso=94% em ar ambiente. Coração: bulhas rítmicas taquicárdicas e hiperfonéticas, sem sopros. Pulmões: murmúrio vesicular diminuído em base direita. Abdome: plano, tenso à palpação, fígado palpável a cerca de 2cm do rebordo costal direito; baço não palpável. Membros: sem edemas. Radiograma de tórax (imagem Q65). Líquido pleural: eritrocrômico; hemácias=27.000/mm3; leucócitos=1.445/mm3 (96% linfomononucleares, 4% polimorfonucleares); raras células mesoteliais; proteínas totais=3,6g/dL; glicose=125mg/dL; desidrogenase láctica=388UI/L; adenosina deaminase=51UI/L. O PROVÁVEL AGENTE ETIOLÓGICO É:",
      "alternativas": null,
      "imagens": [
        {
          "arquivo": "images/2024-ad-p2/q65.png",
          "rotulo": "IMAGEM Q65",
          "legenda": "IMAGEM Q65 (correspondente à questão 65)",
          "pagina": 25
        }
      ],
      "gabarito": {
        "letra": null,
        "resposta_esperada": "Mycobacterium tuberculosis. Não será aceito tuberculose",
        "ampliado": false
      },
      "anulada": false,
      "fonte": {
        "pdf": "https://www.comvest.unicamp.br/residenciamedica2024/provas/dAD2.pdf",
        "pagina": 6
      }
    },
    {
      "id": "unicamp-2024-ad-p2-q66",
      "numero": 66,
      "area": "Clínica Médica",
      "formato": "resposta_curta",
      "enunciado": "Mulher, 32a, iniciou quadro de ptose palpebral à direita (D) há cerca de 20 dias. Há cinco dias evoluiu com quadro de diplopia horizontal, disfagia, disartria e fraqueza em membros, todos com piora expressiva no período noturno, sendo que desperta pela manhã assintomática. Exame físico: ptose palpebral D, disartria e fraqueza muscular de quatro membros nas provas de fatigabilidade, com melhora ao repouso. Pesquisa de anticorpo anti-receptor de acetilcolina=positivo. A NEOPLASIA MAIS COMUMENTE ASSOCIADA A ESSE CASO É:",
      "alternativas": null,
      "imagens": [],
      "gabarito": {
        "letra": null,
        "resposta_esperada": "Timoma",
        "ampliado": false
      },
      "anulada": false,
      "fonte": {
        "pdf": "https://www.comvest.unicamp.br/residenciamedica2024/provas/dAD2.pdf",
        "pagina": 6
      }
    },
    {
      "id": "unicamp-2024-ad-p2-q67",
      "numero": 67,
      "area": "Clínica Médica",
      "formato": "resposta_curta",